Bill_id,Title,Date Introduced,Category,Status,Summary,file_path
Bill_Bills_Parliament,Bills Parliament,,General,Withdrawn,Official bill regarding Bills Parliament.,
Bill_The_Industrial_Relations_Code_Amendment_Bill_2026,"The Industrial Relations Code (Amendment) Bill, 2026","Feb 11, 2026",Labour and Employment Introduced Lok Sabha,Passed,"Official bill regarding The Industrial Relations Code (Amendment) Bill, 2026.",The_Industrial_Relations_Code_Amendment_Bill_2026.pdf
Bill_The_Securities_Markets_Code_2025,"The Securities Markets Code, 2025","Dec 18, 2025",Finance Introduced Lok Sabha Dec,Pending,"Official bill regarding The Securities Markets Code, 2025.",The_Securities_Markets_Code_2025.pdf
Bill_The_Viksit_Bharat_Guarantee_for_Rozgar_and_Ajeevik,"The Viksit Bharat – Guarantee for Rozgar and Ajeevika Mission (Gramin) VB – G RAM G Bill, 2025","Dec 16, 2025",Agriculture and Farmers Welfare Introduced Lok,Passed,"Official bill regarding The Viksit Bharat – Guarantee for Rozgar and Ajeevika Mission (Gramin) VB – G RAM G Bill, 2025.",The_Viksit_Bharat_Guarantee_for_Rozgar_and_Ajeevika_Mission_Gramin_VB_G_RAM_G_Bill_2025.pdf
Bill_The_Sabka_Bima_Sabki_Raksha_Amendment_of_Insurance,"The Sabka Bima Sabki Raksha (Amendment of Insurance Laws) Bill, 2025","Dec 16, 2025",Finance Introduced Lok Sabha Dec,Passed,"Official bill regarding The Sabka Bima Sabki Raksha (Amendment of Insurance Laws) Bill, 2025.",The_Sabka_Bima_Sabki_Raksha_Amendment_of_Insurance_Laws_Bill_2025.pdf
